<?xml version="1.0"?>
<?xml-stylesheet type="text/xsl" href="banner.xsl"?>
<!DOCTYPE SECTION SYSTEM "start.dtd">
<SECTION VISIBLE="1" STYLE="myprograms" MORETARGET="shell:desktopfolder">
	<HEAD>
		<CLASS>myfiles</CLASS>
		<TITLE>My Files and Folders</TITLE>
	</HEAD>
	<ITEMS>
		<ITEM VISIBLE="1" LINKSTYLE="shellexec" CANPICK="1"><TEXT>My Computer</TEXT>
<HREF>::{20D04FE0-3AEA-1069-A2D8-08002B30309D}</HREF>
</ITEM>
<ITEM VISIBLE="1" LINKSTYLE="shellexec" CANPICK="1"><TEXT>My Documents</TEXT>
<HREF>::{450D8FBA-AD25-11D0-98A8-0800361B1103}</HREF>
</ITEM>
<ITEM VISIBLE="1" LINKSTYLE="shellexec" CANPICK="1"><TEXT>Recycle Bin</TEXT>
<HREF>::{645FF040-5081-101B-9F08-00AA002F954E}</HREF>
</ITEM>
<ITEM VISIBLE="0" LINKSTYLE="shellexec" CANPICK="1"><TEXT>My Network Places</TEXT>
<HREF>::{208D2C60-3AEA-1069-A2D7-08002B30309D}</HREF>
</ITEM>
</ITEMS>
	<LOC NAME="more">more...</LOC>
</SECTION>
