<?xml version="1.0"?>
<?xml-stylesheet type="text/xsl" href="banner.xsl"?>
<!DOCTYPE SECTION SYSTEM "start.dtd">

<SECTION VISIBLE="1" SELECTIVE="0" STYLE="ispbanner">
   <HEAD>
       <CLASS>ispbanner</CLASS>
       <TITLE VISIBLE="0">Product Support</TITLE>
   </HEAD>
   <IMAGES>
      <IMAGE>
           <IMGSRC>scheme\mslogo.gif</IMGSRC>
           <HEIGHT>40</HEIGHT>
           <WIDTH>112</WIDTH>
      </IMAGE>
   </IMAGES>
   <ITEMS>
      <ITEM LINKSTYLE="url">
           <TEXT>Product Support</TEXT>
           <TITLE>Ask a question in plain English</TITLE>
           <HREF>http://support.microsoft.com/support/windows/faq/98/default.asp?FR=0</HREF>
      </ITEM>
      <ITEM LINKSTYLE="url">
           <TEXT>Free Downloads</TEXT>
           <TITLE>Enhance your system with these free downloads from Microsoft.</TITLE>
           <HREF>http://www.microsoft.com/downloads/</HREF>
      </ITEM>
   </ITEMS>
</SECTION>
